{
  "$schema": "https://json-schema.org/draft/2020-12/schema",
  "$id": "https://ctxql.example/schemas/p5-7/declaration-evidence-v1.schema.json",
  "type": "object",
  "additionalProperties": false,
  "required": ["$schema", "schema", "profile", "declaration", "classification", "direct_reasoner_inventory", "direct_family_count", "profile_v2_rejection", "profile_v3_direct_and_production_test", "result"],
  "properties": {
    "$schema": {"const": "https://json-schema.org/draft/2020-12/schema"},
    "schema": {"const": "ctxql.p5-7-declaration-evidence/v1"},
    "profile": {"const": "ctxql-ontology-profile/fluree-4.2-603974fad5c13efed9d147d214d613849fb43c73/v3-supported-subset"},
    "declaration": {"const": "owl:NamedIndividual"},
    "classification": {"const": "inference_inert_declaration"},
    "direct_reasoner_inventory": {"const": "fixtures/conformance/p5_6/direct-reasoner-inventory.json"},
    "direct_family_count": {"const": 23},
    "profile_v2_rejection": {"const": "ontology_reserved_type_unsupported"},
    "profile_v3_direct_and_production_test": {"const": "named_individual_is_retained_but_inference_inert_direct_and_production"},
    "result": {"const": "pass"}
  }
}
